<?xml version="1.0" encoding="utf-8"?>
<SqlMapper xmlns:xsi="http://www.w3.org/2001/XMLSchema-instance" xsi:noNamespaceSchemaLocation="file:///E:/Study/SmartXmlSql/SmartXmlSql/SmartXmlSqlMaper.xsd">
	<Statement Id="" DB="" Acess="">
   
     <Where>
			<Choose>
				<When Prepend="And" Dynamic="" IsNotEmpty="">
                       ""
        </When>
				<Otherwise>            
        </Otherwise>
			</Choose>
			<When Prepend="And" IsNotEmpty="" Dynamic="">
         ""
      </When>
			<Switch Prepend="And">
				<Case Dynamic="" IsNotEmpty="">
          ""
        </Case>
				<Default>
           ""
        </Default>
			</Switch>
			<Default>
           ""
       </Default>
		</Where>
		<Choose>
			<When Prepend="And" Dynamic="" IsNotEmpty="">
               ""
             </When>
			<Otherwise>
              ""
              </Otherwise>
		</Choose>
		<When Prepend="And" Dynamic="" IsNotEmpty="">
      ""
     </When>
		<Switch Prepend="And">
			<Case Dynamic="" IsNotEmpty="">
         ""
        </Case>
			<Default>
        ""
        </Default>
		</Switch>
		<Default>
       
        </Default>
		<Set>
    
        </Set>
	</Statement>
</SqlMapper>
